1;的;de;possessive, adjectival suffix;w_hsk1_1;0;0
1765;怒;nù;"anger, rage, passion; angry";w_hsk1_1765;0;0
1766;残;cán;"injure, spoil; oppress; broken";w_hsk1_1766;0;0
1767;宇;yǔ;"house; building, structure; eaves";w_hsk1_1767;0;0
1768;猛;měng;"violent, savage, cruel; bold";w_hsk1_1768;0;0
1769;毁;huǐ;destroy;w_hsk1_1769;0;0
1770;盟;méng;"swear; oath, covenant, alliance";w_hsk1_1770;0;0
1771;丁;dīng;"male adult; robust, vigorous; 4th heavenly stem";w_hsk1_1771;0;0
1772;魔;mó;"demon, evil spirits; magic power";w_hsk1_1772;0;0
1773;沿;yán;follow a course, go along;w_hsk1_1773;0;0
1774;啦;la;final particle of assertion;w_hsk1_1774;0;0
1775;瓦;wǎ;"tile; earthenware pottery; girl";w_hsk1_1775;0;0
1776;援;yuán;"aid, assist; lead; cite";w_hsk1_1776;0;0
1777;夺;duó;take by force, rob, snatch;w_hsk1_1777;0;0
1778;偏;piān;"inclined one side; slanting";w_hsk1_1778;0;0
1779;袭;xí;"raid, attack; inherit";w_hsk1_1779;0;0
1780;侠;xiá;"chivalrous person; knight-errant";w_hsk1_1780;0;0
1781;侧;cè;"side; incline, slant, lean";w_hsk1_1781;0;0
1782;债;zhài;debt, loan, liabilities;w_hsk1_1782;0;0
1783;融;róng;"melt, fuse; blend, harmonize";w_hsk1_1783;0;0
1784;纵;zòng;indulge in, give free reign to;w_hsk1_1784;0;0
1785;障;zhàng;"separate; shield; barricade";w_hsk1_1785;0;0
1786;讯;xùn;"inquire; ask; examine; reproach";w_hsk1_1786;0;0
1787;涉;shè;ford stream, wade across;w_hsk1_1787;0;0
1788;刊;kān;"publication, periodical; publish";w_hsk1_1788;0;0
1789;爆;bào;crackle, pop, burst, explode;w_hsk1_1789;0;0
1790;乌;wū;"crow, rook, raven; black, dark";w_hsk1_1790;0;0
1791;役;yì;"service; a servant, laborer; to serve";w_hsk1_1791;0;0
1792;患;huàn;"suffer, worry about; suffering";w_hsk1_1792;0;0
1793;仙;xiān;Taoist super-being, transcendent, immortal;w_hsk1_1793;0;0
1794;症;zhèng;disease, illness, ailment;w_hsk1_1794;0;0
1795;倾;qīng;upset, pour out, overflow;w_hsk1_1795;0;0
1796;陷;xiàn;"submerge, sink, plunge; trap";w_hsk1_1796;0;0
1797;轰;hōng;rumble, explosion, blast;w_hsk1_1797;0;0
1798;撤;chè;"omit; remove; withdraw";w_hsk1_1798;0;0
1799;疾;jí;"illness, disease, sickness; to hate";w_hsk1_1799;0;0
1800;缘;yuán;"hem, margin; reason, cause; fate";w_hsk1_1800;0;0
1801;杜;dù;"stop, prevent; restrict; surname";w_hsk1_1801;0;0
1802;仪;yí;"ceremony, rites gifts; admire";w_hsk1_1802;0;0
1803;奔;bēn;"run fast, flee; rush about; run";w_hsk1_1803;0;0
1804;珠;zhū;precious stone, gem, jewel, pearl;w_hsk1_1804;0;0
1805;驻;zhù;"to be stationed at, reside at; to stop";w_hsk1_1805;0;0
1806;孔;kǒng;"opening, hole, orifice; great";w_hsk1_1806;0;0
1807;翼;yì;"wings; fins on fish; shelter";w_hsk1_1807;0;0
1808;叹;tàn;sigh, admire;w_hsk1_1808;0;0
1809;愈;yù;more and more, even more;w_hsk1_1809;0;0
1810;罢;bà;"cease, finish, stop; give up";w_hsk1_1810;0;0
1811;径;jìng;"narrow path; diameter; direct";w_hsk1_1811;0;0
1812;恰;qià;"just, exactly, precisely; proper";w_hsk1_1812;0;0
1813;捕;bǔ;arrest, catch, seize;w_hsk1_1813;0;0
1814;裂;liè;"split, crack, break open; rend";w_hsk1_1814;0;0
1815;泰;tài;"great, exalted, superior; big";w_hsk1_1815;0;0
1816;尖;jiān;sharp, pointed, acute, keen;w_hsk1_1816;0;0
1817;忠;zhōng;loyalty, devotion, fidelity;w_hsk1_1817;0;0
1818;炎;yán;"flame, blaze; hot";w_hsk1_1818;0;0
1819;荒;huāng;"wasteland, desert; uncultivated";w_hsk1_1819;0;0
1820;横;héng;across;w_hsk1_1820;0;0
1821;孤;gū;"orphan, fatherless; solitary";w_hsk1_1821;0;0
1822;胞;bāo;womb, placenta, fetal membrane;w_hsk1_1822;0;0
1823;魂;hún;soul, spirit;w_hsk1_1823;0;0
1824;洪;hóng;"vast, immense; flood, deluge";w_hsk1_1824;0;0
1825;津;jīn;"ferry; saliva; ford";w_hsk1_1825;0;0
1826;晓;xiǎo;"dawn, daybreak; clear, explicit";w_hsk1_1826;0;0
1827;仁;rén;humaneness, benevolence, kindness;w_hsk1_1827;0;0
1828;贫;pín;poor, impoverished, needy;w_hsk1_1828;0;0
1829;赖;lài;"rely, depend on; accuse falsely";w_hsk1_1829;0;0
1830;仰;yǎng;"raise the head to look; look up to, rely on, admire";w_hsk1_1830;0;0
1831;艇;tǐng;small boat, dugout, punt;w_hsk1_1831;0;0
1832;凶;xiōng;"culprit; murder; bad, sad";w_hsk1_1832;0;0
1833;署;shǔ;public office;w_hsk1_1833;0;0
1834;御;yù;"drive, ride; chariot; manage";w_hsk1_1834;0;0
1835;奉;fèng;"offer; receive; serve; respect";w_hsk1_1835;0;0
1836;旋;xuán;"revolve, move in orbit; return";w_hsk1_1836;0;0
1837;晨;chén;early morning, daybreak;w_hsk1_1837;0;0
1838;伏;fú;crouch, crawl, lie hidden, conceal;w_hsk1_1838;0;0
1839;隆;lóng;prosperous, plentiful, abundant;w_hsk1_1839;0;0
1840;奴;nú;slave, servant;w_hsk1_1840;0;0
1841;丧;sàng;"mourning; mourn; funeral";w_hsk1_1841;0;0
1842;渡;dù;"cross, ferry over; ferry";w_hsk1_1842;0;0
1843;旗;qí;banner, flag, streamer;w_hsk1_1843;0;0
1844;甘;gān;"sweetness; sweet, tasty";w_hsk1_1844;0;0
1845;扎;zhā;"pull up; pierce; struggle free";w_hsk1_1845;0;0
1846;梁;liáng;"bridge; beam; rafters; surname";w_hsk1_1846;0;0
1847;皆;jiē;all, every, everybody;w_hsk1_1847;0;0
1848;宙;zhòu;"time as concept; infinite time";w_hsk1_1848;0;0
1849;岩;yán;"cliff; rocks; mountain";w_hsk1_1849;0;0
1850;荡;dàng;"pond, pool; wash away, cleanse";w_hsk1_1850;0;0
1851;蒂;dì;peduncle or stem of plants;w_hsk1_1851;0;0
1852;井;jǐng;well, mine shaft, pit;w_hsk1_1852;0;0
1853;壮;zhuàng;"big, large; robust; name of tribe";w_hsk1_1853;0;0
1854;殖;zhí;"breed, spawn; increase; prosper";w_hsk1_1854;0;0
1855;霍;huò;"quickly, suddenly; surname";w_hsk1_1855;0;0
1856;撒;sā;"release, cast away, let go; disperse; relax";w_hsk1_1856;0;0
1857;液;yè;sap, juice, liquid, fluid;w_hsk1_1857;0;0
1858;番;fān;"to take turns; a turn, a time; to repeat";w_hsk1_1858;0;0
1859;郎;láng;"gentleman, young man; husband";w_hsk1_1859;0;0
1860;忧;yōu;"sad, grieved; grief, melancholy";w_hsk1_1860;0;0
1861;浮;fú;"to float, drift, waft; to exceed; superfluous";w_hsk1_1861;0;0
1862;艘;sōu;counter for ships, vessels;w_hsk1_1862;0;0
1863;伍;wǔ;"five, company of five; troops";w_hsk1_1863;0;0
1864;峰;fēng;"peak, summit; hump of camel";w_hsk1_1864;0;0
1865;黎;lí;"surname; numerous, many; black";w_hsk1_1865;0;0
1866;贯;guàn;"a string of 1000 coins; to go through";w_hsk1_1866;0;0
1867;侦;zhēn;"spy, reconnoiter; detective";w_hsk1_1867;0;0
1868;券;quàn;"certificate, ticket; title deeds";w_hsk1_1868;0;0
1869;崇;chóng;esteem, honor, revere, venerate;w_hsk1_1869;0;0
1870;宪;xiàn;constitution, statute, law;w_hsk1_1870;0;0
1871;慈;cí;kind, charitable, benevolent;w_hsk1_1871;0;0
1872;枝;zhī;"branches, limbs; branch off";w_hsk1_1872;0;0
1873;拖;tuō;"drag, tow, haul; delay, prolong";w_hsk1_1873;0;0
1874;墨;mò;"ink; writing";w_hsk1_1874;0;0
1875;箭;jiàn;"arrow; type of bamboo";w_hsk1_1875;0;0
1876;泥;ní;"mud, mire; earth, clay; plaster";w_hsk1_1876;0;0
1877;粉;fěn;"powder, face powder; plaster";w_hsk1_1877;0;0
1878;氏;shì;"clan, family; mister";w_hsk1_1878;0;0
1879;拔;bá;uproot, pull out;w_hsk1_1879;0;0
1880;愤;fèn;"resent, hate; indignant";w_hsk1_1880;0;0
1881;扑;pū;"pound, beat, strike; attack";w_hsk1_1881;0;0
1882;驱;qū;"spur a horse on; expel, drive away";w_hsk1_1882;0;0
1883;掩;yǎn;"to cover (with the hand); shut, conceal; ambush";w_hsk1_1883;0;0
1884;尸;shī;"corpse; to impersonate the dead; to preside; KangXi radical 44";w_hsk1_1884;0;0
1885;堡;bǎo;"fort, fortress; town, village";w_hsk1_1885;0;0
1886;储;chǔ;"save money, store, reserve; heir";w_hsk1_1886;0;0
1887;桑;sāng;"mulberry tree; surname";w_hsk1_1887;0;0
1888;惨;cǎn;"sad, pitiful, wretched; cruel";w_hsk1_1888;0;0
1889;洁;jié;clean, purify, pure;w_hsk1_1889;0;0
1890;踪;zōng;footprints, traces, tracks;w_hsk1_1890;0;0
1891;勃;bó;suddenly, sudden, quick;w_hsk1_1891;0;0
1892;仇;chóu;enemy, hate, hatred, enmity;w_hsk1_1892;0;0
1893;磨;mó;"grind; polish; rub; wear out; a millstone";w_hsk1_1893;0;0
1894;拟;nǐ;"draft; intend, plan, propose";w_hsk1_1894;0;0
1895;奏;zòu;"memorialize emperor; report";w_hsk1_1895;0;0
1896;巡;xún;patrol, go on circuit, cruise;w_hsk1_1896;0;0
1897;剂;jì;medicinal preparation;w_hsk1_1897;0;0
1898;坡;pō;slope, bank, hillside;w_hsk1_1898;0;0
1899;截;jié;cut off, stop, obstruct, intersect;w_hsk1_1899;0;0
1900;焦;jiāo;"burned, scorched; anxious, vexed";w_hsk1_1900;0;0
1901;殿;diàn;"hall; palace; temple";w_hsk1_1901;0;0
1902;伪;wěi;false, counterfeit, bogus;w_hsk1_1902;0;0
1903;逼;bī;"compel, pressure, force; bother";w_hsk1_1903;0;0
1904;颇;pō;"lean one side; very, rather";w_hsk1_1904;0;0
1905;昏;hūn;dusk, nightfall, twilight, dark;w_hsk1_1905;0;0
1906;呈;chéng;"submit, show; appear; petition";w_hsk1_1906;0;0
1907;牧;mù;tend cattle, shepherd;w_hsk1_1907;0;0
1908;牲;shēng;"sacrificial animal; animal";w_hsk1_1908;0;0
1909;佳;jiā;"good, auspicious; beautiful; delightful";w_hsk1_1909;0;0
1910;稿;gǎo;draft, manuscript, rough copy;w_hsk1_1910;0;0
1911;腹;fù;"stomach, belly, abdomen; inside";w_hsk1_1911;0;0
1912;跌;diē;"stumble, slip, fall down; stamp";w_hsk1_1912;0;0
1913;垂;chuí;"let down; suspend, hand; down";w_hsk1_1913;0;0
1914;脉;mài;blood vessels, veins, arteries;w_hsk1_1914;0;0
1915;狱;yù;"prison, jail; case; lawsuit";w_hsk1_1915;0;0
1916;惑;huò;"confuse, mislead, baffle; doubt";w_hsk1_1916;0;0
1917;陶;táo;pottery, ceramics;w_hsk1_1917;0;0
1918;兽;shòu;"beast, animal; bestial";w_hsk1_1918;0;0
1919;帐;zhàng;"tent; screen, mosquito net";w_hsk1_1919;0;0
1920;昌;chāng;"light of sun; good, proper";w_hsk1_1920;0;0
1921;铺;pù;"shop, store; place sleep, bed";w_hsk1_1921;0;0
1922;惧;jù;fear, be afraid of, dread;w_hsk1_1922;0;0
1923;盗;dào;"rob, steal; thief, bandit";w_hsk1_1923;0;0
1924;辉;huī;brightness, luster, brilliance;w_hsk1_1924;0;0
1925;扣;kòu;"knock, strike, rap, tap; button";w_hsk1_1925;0;0
1926;嘛;ma;final exclamatory particle;w_hsk1_1926;0;0
1927;董;dǒng;"direct, supervise; surname";w_hsk1_1927;0;0
1928;迁;qiān;"move, shift, change; transfer; relocate a capital city";w_hsk1_1928;0;0
1929;凝;níng;"coagulate; congeal; freeze";w_hsk1_1929;0;0
1930;腾;téng;"fly; gallop; run; prance; rise";w_hsk1_1930;0;0
1931;埋;mái;bury, secrete, conceal;w_hsk1_1931;0;0
1932;涌;yǒng;surge up, bubble up, gush forth;w_hsk1_1932;0;0
1933;辖;xiá;"linchpin of wheel; control";w_hsk1_1933;0;0
1934;晋;jìn;"advance, increase; promote";w_hsk1_1934;0;0
1935;狠;hěn;"vicious, cruel; severely, extreme";w_hsk1_1935;0;0
1936;鉴;jiàn;"mirror, looking glass; reflect";w_hsk1_1936;0;0
1937;械;xiè;"weapons; implements, instruments";w_hsk1_1937;0;0
1938;赤;chì;"red; communist, 'red'; bare";w_hsk1_1938;0;0
1939;割;gē;"cut, divide, partition; cede";w_hsk1_1939;0;0
1940;揭;jiē;"raise, lift up; surname";w_hsk1_1940;0;0
1941;悟;wù;to apprehend, realize, become aware;w_hsk1_1941;0;0
1942;锋;fēng;point of spear, sharp point;w_hsk1_1942;0;0
1943;祥;xiáng;"good luck, good omen; happiness";w_hsk1_1943;0;0
1944;阔;kuò;"broad, ample, wide; be apart";w_hsk1_1944;0;0
1945;誉;yù;"fame, reputation; praise";w_hsk1_1945;0;0
1946;筹;chóu;"chip, tally, token; raise money";w_hsk1_1946;0;0
1947;丛;cóng;"bush, shrub; thicket; collection";w_hsk1_1947;0;0
1948;牵;qiān;drag, pull, lead by hand;w_hsk1_1948;0;0
1949;鸣;míng;"cry of bird or animal; make sound";w_hsk1_1949;0;0
1950;旨;zhǐ;"purpose, aim; excellent";w_hsk1_1950;0;0
1951;袖;xiù;"sleeve; put something in sleeve";w_hsk1_1951;0;0
1952;猎;liè;"hunt; field sports";w_hsk1_1952;0;0
1953;臂;bì;arm;w_hsk1_1953;0;0
1954;柱;zhù;"pillar, post; support; lean on";w_hsk1_1954;0;0
1955;抛;pāo;throw (away);w_hsk1_1955;0;0
1956;牢;láo;"prison; stable, pen; secure";w_hsk1_1956;0;0
1957;逊;xùn;"humble, modest; yield";w_hsk1_1957;0;0
1958;迈;mài;"take a big stride; pass by";w_hsk1_1958;0;0
1959;欺;qī;cheat, double-cross, deceive;w_hsk1_1959;0;0
1960;衰;shuāi;"decline, falter, decrease; weaken";w_hsk1_1960;0;0
1961;诱;yòu;"persuade, entice, induce; guide";w_hsk1_1961;0;0
1962;狼;láng;wolf;w_hsk1_1962;0;0
1963;仗;zhàng;"rely upon; protector; fight; war, weaponry";w_hsk1_1963;0;0
1964;粒;lì;"grain; small particle";w_hsk1_1964;0;0
1965;遥;yáo;far away, distant, remote;w_hsk1_1965;0;0
1966;抚;fǔ;"pat, console, comfort; pacify";w_hsk1_1966;0;0
1967;纠;jiū;investigate, inspect;w_hsk1_1967;0;0
1968;钻;zuān;"drill, bore; pierce; diamond";w_hsk1_1968;0;0
1969;晶;jīng;"crystal; clear, bright; radiant";w_hsk1_1969;0;0
1970;岂;qǐ;how? what?;w_hsk1_1970;0;0
1971;峡;xiá;"gorge, strait, ravine; isthmus";w_hsk1_1971;0;0
1972;苍;cāng;"blue; green";w_hsk1_1972;0;0
1973;耗;hào;"consume, use up; waste, squander";w_hsk1_1973;0;0
1974;菌;jūn;"mushroom; germ, microbe";w_hsk1_1974;0;0
1975;粹;cuì;"pure; unadulterated; select";w_hsk1_1975;0;0
1976;扁;biǎn;"flat; tablet, signboard";w_hsk1_1976;0;0
1977;循;xún;obey, comply with, follow;w_hsk1_1977;0;0
1978;赋;fù;"tax; give; endow; army; diffuse";w_hsk1_1978;0;0
1979;抑;yì;"press down, repress; curb, hinder";w_hsk1_1979;0;0
1980;哀;āi;"sad, mournful, pitiful; pity";w_hsk1_1980;0;0
1981;踏;tà;step on, trample, tread on, walk;w_hsk1_1981;0;0
1982;恒;héng;constant, regular, persistent;w_hsk1_1982;0;0
1983;纽;niǔ;"knot; button; handle, knob; tie";w_hsk1_1983;0;0
1984;纹;wén;"line, streak, stripe; wrinkle";w_hsk1_1984;0;0
1985;渔;yú;"to fish; seize; pursue; surname";w_hsk1_1985;0;0
1986;磁;cí;"magnetic; magnetism; porcelain";w_hsk1_1986;0;0
1987;铜;tóng;copper, brass, bronze;w_hsk1_1987;0;0
1988;跨;kuà;"straddle, bestride, ride; carry";w_hsk1_1988;0;0
1989;怖;bù;"terror, fear; frighten; terrified";w_hsk1_1989;0;0
1990;叛;pàn;"rebel; rebellion; rebellious";w_hsk1_1990;0;0
1991;遣;qiǎn;"send, dispatch; send off, exile";w_hsk1_1991;0;0
1992;弥;mí;"extensive, full; fill; complete";w_hsk1_1992;0;0
1993;稀;xī;"rare, unusual, scarce; sparse";w_hsk1_1993;0;0
1994;捷;jié;win, victory, triumph;w_hsk1_1994;0;0
1995;疫;yì;epidemic, plague, pestilence;w_hsk1_1995;0;0
1996;肿;zhǒng;"swell; swollen; swelling";w_hsk1_1996;0;0
1997;削;xuē;scrape off, pare, trim;w_hsk1_1997;0;0
1998;岗;gǎng;"post; position";w_hsk1_1998;0;0
1999;晃;huǎng;"bright, dazzling; to sway, shake";w_hsk1_1999;0;0
2000;吞;tūn;"swallow; absorb, annex, engulf";w_hsk1_2000;0;0
2001;宏;hóng;wide, spacious, great, vast;w_hsk1_2001;0;0
2002;癌;ái;"cancer; marmoset";w_hsk1_2002;0;0
2003;隶;lì;"subservient; servant; KangXi radical 171";w_hsk1_2003;0;0
2004;履;lǚ;"footwear, shoes; walk on, tread";w_hsk1_2004;0;0
2005;耀;yào;"shine, sparkle, dazzle; glory";w_hsk1_2005;0;0
2006;扭;niǔ;"turn, twist, wrench; seize, grasp";w_hsk1_2006;0;0
2007;坛;tán;"altar; arena, examination hall";w_hsk1_2007;0;0
2008;拨;bō;"move; dispel; distribute";w_hsk1_2008;0;0
2009;沃;wò;"water, irrigate; fertile, rich";w_hsk1_2009;0;0
2010;绘;huì;draw, sketch, paint;w_hsk1_2010;0;0
2011;伐;fá;cut down, subjugate, attack;w_hsk1_2011;0;0
2012;堪;kān;adequately capable of, worthy of;w_hsk1_2012;0;0
2013;牺;xī;"sacrifice, give up; sacrificial";w_hsk1_2013;0;0
2014;墓;mù;grave, tomb;w_hsk1_2014;0;0
2015;雇;gù;employ, to hire;w_hsk1_2015;0;0
2016;廉;lián;upright, honorable, honest;w_hsk1_2016;0;0
2017;惩;chéng;"punish, reprimand; warn";w_hsk1_2017;0;0
2018;捉;zhuō;"grasp, clutch; catch, seize";w_hsk1_2018;0;0
2019;覆;fù;"cover; tip over; return; reply";w_hsk1_2019;0;0
2020;劫;jié;"take by force, coerce; disaster";w_hsk1_2020;0;0
2021;嫌;xián;"hate, detest; suspect; criticize";w_hsk1_2021;0;0
2022;雕;diāo;"engrave, inlay, carve; exhaust; used for 鵰 an eagle, vulture";w_hsk1_2022;0;0
2023;闷;mèn;gloomy, depressed, melancholy;w_hsk1_2023;0;0
2024;乳;rǔ;"breast, nipples; milk, suckle";w_hsk1_2024;0;0
2025;串;chuàn;"string; relatives; conspire";w_hsk1_2025;0;0
2026;娃;wá;"baby; doll; pretty girl";w_hsk1_2026;0;0
2027;缴;jiǎo;"deliver, submit; hand over";w_hsk1_2027;0;0
2028;唤;huàn;call;w_hsk1_2028;0;0
2029;霸;bà;rule by might rather than right;w_hsk1_2029;0;0
2030;妥;tuǒ;satisfactory, appropriate;w_hsk1_2030;0;0
2031;搭;dā;"join together, attach to; add to";w_hsk1_2031;0;0
2032;赴;fù;"go to; attend, be present";w_hsk1_2032;0;0
2033;岳;yuè;"mountain peak; surname";w_hsk1_2033;0;0
2034;舱;cāng;"hold of ship; cabin";w_hsk1_2034;0;0
2035;庞;páng;"disorderly, messy; huge, big";w_hsk1_2035;0;0
2036;耕;gēng;plow, cultivate;w_hsk1_2036;0;0
2037;锐;ruì;sharp, keen, acute, pointed;w_hsk1_2037;0;0
2038;缝;fèng;sew, mend;w_hsk1_2038;0;0
2039;宅;zhái;"residence, dwelling, home; grave";w_hsk1_2039;0;0
2040;斥;chì;to scold, upbraid, accuse, reproach;w_hsk1_2040;0;0
2041;添;tiān;"append, add to; increase";w_hsk1_2041;0;0
2042;挖;wā;dig, dig out, gouge out, scoop;w_hsk1_2042;0;0
2043;呵;ā;"scold; laughing sound; yawn";w_hsk1_2043;0;0
2044;讼;sòng;"accuse; argue, dispute; litigate";w_hsk1_2044;0;0
2045;氧;yǎng;oxygen;w_hsk1_2045;0;0
2046;酷;kù;"strong, stimulating; very";w_hsk1_2046;0;0
2047;掠;lüè;"rob, ransack, plunder; pass by";w_hsk1_2047;0;0
2048;祸;huò;misfortune, calamity, disaster;w_hsk1_2048;0;0
2049;贪;tān;"be greedy, covet; covetous";w_hsk1_2049;0;0
2050;悬;xuán;"hang, suspend, hoist; be hung";w_hsk1_2050;0;0
2051;唇;chún;lips;w_hsk1_2051;0;0
2052;仓;cāng;"granary; berth; sea";w_hsk1_2052;0;0
2053;轨;guǐ;track, rut, path;w_hsk1_2053;0;0
2054;枚;méi;stalk of shrub, trunk of tree;w_hsk1_2054;0;0
2055;庙;miào;"temple, shrine; imperial court";w_hsk1_2055;0;0
2056;屏;píng;folding screen, shield;w_hsk1_2056;0;0
2057;寺;sì;"court, office; temple, monastery";w_hsk1_2057;0;0
2058;愚;yú;stupid, doltish, foolish;w_hsk1_2058;0;0
2059;疏;shū;"neglect; careless, lax";w_hsk1_2059;0;0
2060;颤;chàn;"shiver, tremble; trembling";w_hsk1_2060;0;0
2061;寸;cùn;"inch; small, tiny; KangXi radical 41";w_hsk1_2061;0;0
2062;盯;dīng;rivet gaze upon, keep eyes on;w_hsk1_2062;0;0
2063;辱;rǔ;humiliate, insult, abuse;w_hsk1_2063;0;0
2064;辨;biàn;distinguish, discriminate;w_hsk1_2064;0;0
2065;哦;ó;oh? really? is that so?;w_hsk1_2065;0;0
2066;腔;qiāng;"chest cavity; hollow in body";w_hsk1_2066;0;0
2067;郁;yù;"sweet smelling, rich in aroma; (Cant.) to move, hit";w_hsk1_2067;0;0
2068;溃;kuì;"flooding river; militarily defeat";w_hsk1_2068;0;0
2069;忌;jì;"jealous, envious; fear";w_hsk1_2069;0;0
2070;溜;liū;"slide, glide, slip; slippery";w_hsk1_2070;0;0
2071;笼;lóng;"cage; cage-like basket";w_hsk1_2071;0;0
2072;丘;qiū;"hill; elder; empty; a name";w_hsk1_2072;0;0
2073;滋;zī;"grow, multiply, increase; thrive";w_hsk1_2073;0;0
2074;壳;ké;casing, shell, husk;w_hsk1_2074;0;0
2075;痕;hén;"scar; mark; trace";w_hsk1_2075;0;0
2076;穴;xué;"cave, den, hole; KangXi radical 116";w_hsk1_2076;0;0
2077;卓;zhuō;profound, brilliant, lofty;w_hsk1_2077;0;0
2078;贤;xián;"virtuous, worthy, good; able";w_hsk1_2078;0;0
2079;膜;mó;"membrane; to kneel and worship";w_hsk1_2079;0;0
2080;毅;yì;resolute, decisive, firm, persist;w_hsk1_2080;0;0
2081;锦;jǐn;"brocade, tapestry; embroidered";w_hsk1_2081;0;0
2082;茫;máng;vast, boundless, widespread;w_hsk1_2082;0;0
2083;昂;áng;"rise, raise; proud, bold; upright";w_hsk1_2083;0;0
2084;皱;zhòu;wrinkles, creases, folds;w_hsk1_2084;0;0
2085;舌;shé;"tongue; clapper of bell; KangXi radical 135";w_hsk1_2085;0;0
2086;剥;bō;peel;w_hsk1_2086;0;0
2087;窝;wō;"nest; cave, den; hiding place";w_hsk1_2087;0;0
2088;携;xié;"lead by hand, take with; carry";w_hsk1_2088;0;0
2089;陵;líng;"hill, mound; mausoleum";w_hsk1_2089;0;0
2090;哼;hēng;"hum; sing softly; groan, moan; (Cant.) an interjecting indicating disapproval";w_hsk1_2090;0;0
2091;棉;mián;"cotton; cotton padded";w_hsk1_2091;0;0
2092;饲;sì;"raise animals; feed; nourish";w_hsk1_2092;0;0
2093;逆;nì;"disobey, rebel; rebel, traitor";w_hsk1_2093;0;0
2094;喘;chuǎn;pant, gasp, breathe heavily;w_hsk1_2094;0;0
2095;罩;zhào;"basket for catching fish; cover";w_hsk1_2095;0;0
2096;炉;lú;fireplace, stove, oven, furnace;w_hsk1_2096;0;0
2097;胎;tāi;unborn child, embryo, fetus;w_hsk1_2097;0;0
2098;蓄;xù;store, save, hoard, gather;w_hsk1_2098;0;0
2099;竭;jié;"put forth great effort; exhaust";w_hsk1_2099;0;0
2100;浑;hún;"muddy, turbid; blend, merge, mix";w_hsk1_2100;0;0
2101;悦;yuè;pleased, contented, gratified;w_hsk1_2101;0;0
2102;诞;dàn;"bear children, give birth; birth";w_hsk1_2102;0;0
2103;泡;pào;"bubbles, suds; blister; soak";w_hsk1_2103;0;0
2104;贼;zéi;"thief, traitor; kill";w_hsk1_2104;0;0
2105;亭;tíng;"pavilion; erect";w_hsk1_2105;0;0
2106;酬;chóu;"toast; reward, recompense";w_hsk1_2106;0;0
2107;儒;rú;Confucian scholar;w_hsk1_2107;0;0
2108;泄;xiè;"leak; vent; flow; reveal";w_hsk1_2108;0;0
2109;杆;gān;"pole; shaft of spear";w_hsk1_2109;0;0
2110;挨;āi;"near, close by, next to, towards, against; to wait; to lean on";w_hsk1_2110;0;0
2111;吟;yín;"sing, hum; recite; type of poetry";w_hsk1_2111;0;0
2112;狭;xiá;"narrow, limited; narrow-minded";w_hsk1_2112;0;0
2113;肖;xiào;look like, resemble, be like;w_hsk1_2113;0;0
2114;霞;xiá;rosy clouds;w_hsk1_2114;0;0
2115;驳;bó;"varicolored, variegated; mixed";w_hsk1_2115;0;0
2116;裕;yù;abundant, rich, plentiful;w_hsk1_2116;0;0
2117;顽;wán;"obstinate, stubborn; recalcitrant";w_hsk1_2117;0;0
2118;畜;chù;livestock, domestic animals;w_hsk1_2118;0;0
2119;咽;yàn;"throat; pharynx";w_hsk1_2119;0;0
2120;勾;gōu;"hook, join, connect; entice";w_hsk1_2120;0;0
2121;疆;jiāng;boundary, border, frontier;w_hsk1_2121;0;0
2122;赌;dǔ;"bet, gamble, wager; compete";w_hsk1_2122;0;0
2123;畏;wèi;fear, dread, awe, reverence;w_hsk1_2123;0;0
2124;泊;pō;"anchor vessel; lie at anchor";w_hsk1_2124;0;0
2125;肺;fèi;lungs;w_hsk1_2125;0;0
2126;缠;chán;"wrap, wind around; tie, bind";w_hsk1_2126;0;0
2127;瞪;dèng;stare at;w_hsk1_2127;0;0
2128;吊;diào;"condole, mourn, pity; hang";w_hsk1_2128;0;0
2129;斑;bān;mottled, striped, freckle;w_hsk1_2129;0;0
2130;涛;tāo;large waves;w_hsk1_2130;0;0
2131;俘;fú;"prisoner of war; take as prisoner";w_hsk1_2131;0;0
2132;卑;bēi;"humble, low, inferior; despise";w_hsk1_2132;0;0
2133;葬;zàng;bury, inter;w_hsk1_2133;0;0
2134;铭;míng;inscribe, engrave;w_hsk1_2134;0;0
2135;蛮;mán;"barbarians; barbarous, savage";w_hsk1_2135;0;0
2136;歧;qí;"fork of road; branching off";w_hsk1_2136;0;0
2137;廊;láng;corridor, porch, veranda;w_hsk1_2137;0;0
2138;灌;guàn;"pour; water; irrigate, flood";w_hsk1_2138;0;0
2139;勉;miǎn;"endeavor, make effort; urge";w_hsk1_2139;0;0
2140;盲;máng;"blind; unperceptive, shortsighted";w_hsk1_2140;0;0
2141;宰;zǎi;"to slaughter; to rule";w_hsk1_2141;0;0
2142;啥;shà;what?;w_hsk1_2142;0;0
2143;胀;zhàng;swell, inflate, expand;w_hsk1_2143;0;0
2144;扯;chě;"rip up, tear down; raise; haul";w_hsk1_2144;0;0
2145;辽;liáo;distant, far;w_hsk1_2145;0;0
2146;抹;mǒ;smear, apply, wipe off, erase;w_hsk1_2146;0;0
2147;筒;tǒng;"thick piece of bamboo; pipe";w_hsk1_2147;0;0
2148;朴;pǔ;"simple, unadorned; sincere; surname; a tree";w_hsk1_2148;0;0
2149;咐;fù;instruct, order;w_hsk1_2149;0;0
2150;誓;shì;"swear, pledge; oath";w_hsk1_2150;0;0
2151;喉;hóu;"throat, gullet, larynx; guttural";w_hsk1_2151;0;0
2152;妄;wàng;"absurd, foolish, reckless; false";w_hsk1_2152;0;0
2153;拘;jū;restrain, seize, detain;w_hsk1_2153;0;0
2154;驰;chí;"go quickly or swiftly; hurry";w_hsk1_2154;0;0
2155;栏;lán;"railing, balustrade; animal pan";w_hsk1_2155;0;0
2156;逝;shì;"pass away; die";w_hsk1_2156;0;0
2157;窃;qiè;"secretly, stealthily; steal; thief";w_hsk1_2157;0;0
2158;纤;xiān;"fine, delicate; minute; graceful";w_hsk1_2158;0;0
2159;盈;yíng;"fill; full, overflowing; surplus";w_hsk1_2159;0;0
2160;瞬;shùn;"wink, blink; in a wink, a flash";w_hsk1_2160;0;0
2161;婴;yīng;"baby, infant; bother";w_hsk1_2161;0;0
2162;颈;jǐng;neck, throat;w_hsk1_2162;0;0
2163;倘;tǎng;if, supposing, in event of;w_hsk1_2163;0;0
2164;蔽;bì;"cover, hide, conceal; shelter";w_hsk1_2164;0;0
2165;畅;chàng;smoothly, freely, unrestrained;w_hsk1_2165;0;0
2166;赠;zèng;"give present; bestow, confer";w_hsk1_2166;0;0
2167;跪;guì;kneel;w_hsk1_2167;0;0
2168;颠;diān;"top, peak, summit; upset";w_hsk1_2168;0;0
2169;遮;zhē;cover, shield, protect;w_hsk1_2169;0;0
2170;吁;xū;"interjection 'Alas!'; to sigh";w_hsk1_2170;0;0
2171;辟;pì;"law, rule; open up, develop";w_hsk1_2171;0;0
2172;瘤;liú;tumor, lump, goiter;w_hsk1_2172;0;0
2173;嫂;sǎo;sister-in-law, elder brother's wife;w_hsk1_2173;0;0
2174;框;kuāng;"frame; framework; door frame";w_hsk1_2174;0;0
2175;钦;qīn;"respect, admire; respectful";w_hsk1_2175;0;0
2176;庸;yōng;usual, common, ordinary, mediocre;w_hsk1_2176;0;0
2177;吼;hǒu;"roar, shout; bark, howl";w_hsk1_2177;0;0
2178;摊;tān;"spread out, open; apportion";w_hsk1_2178;0;0
2179;嘱;zhǔ;order, tell, instruct, leave word;w_hsk1_2179;0;0
2180;衷;zhōng;heart, from bottom of one's heart;w_hsk1_2180;0;0
2181;娇;jiāo;"seductive and loveable; tender";w_hsk1_2181;0;0
2182;讶;yà;express surprise, be surprised;w_hsk1_2182;0;0
2183;耸;sǒng;"urge on; rise up; stir, excite";w_hsk1_2183;0;0
2184;摧;cuī;destroy, break, injure;w_hsk1_2184;0;0
2185;薪;xīn;"fuel, firewood; salary";w_hsk1_2185;0;0
2186;淋;lín;"drip, soak, drench; perfectly";w_hsk1_2186;0;0
2187;耻;chǐ;"shame, humiliation; ashamed";w_hsk1_2187;0;0
2188;饥;jī;"hunger, starving; hungry; a famine";w_hsk1_2188;0;0
2189;崩;bēng;rupture, split apart, collapse;w_hsk1_2189;0;0
2190;逢;féng;"come upon, happen meet; flatter";w_hsk1_2190;0;0
2191;撑;chēng;"prop up, support; brace";w_hsk1_2191;0;0
2192;翔;xiáng;"soar, glide, hover; detailed";w_hsk1_2192;0;0
2193;枯;kū;dried out, withered, decayed;w_hsk1_2193;0;0
2194;凑;còu;piece together, assemble;w_hsk1_2194;0;0
2195;溪;xī;mountain stream, creek;w_hsk1_2195;0;0
2196;蠢;chǔn;"wriggle; stupid; silly; fat";w_hsk1_2196;0;0
2197;阐;chǎn;explain, clarify, elucidate;w_hsk1_2197;0;0
2198;旺;wàng;"prosper; prosperous; increase";w_hsk1_2198;0;0
2199;碑;bēi;"stone tablet; gravestone";w_hsk1_2199;0;0
