1;的;de;possessive, adjectival suffix;w_hsk1_1;0;0
2;一;yī;"one; a, an; alone";w_hsk1_2;0;0
3;是;shì;"indeed, yes, right; to be; demonstrative pronoun, this, that";w_hsk1_3;0;0
4;不;bù;"no, not; un-; negative prefix";w_hsk1_4;0;0
5;了;le;"to finish; particle of completed action";w_hsk1_5;0;0
6;在;zài;"be at, in, on; consist in, rest";w_hsk1_6;0;0
7;人;rén;"man; people; mankind; someone else";w_hsk1_7;0;0
8;有;yǒu;"have, own, possess; exist";w_hsk1_8;0;0
9;我;wǒ;our, us, i, me, my, we;w_hsk1_9;0;0
10;他;tā;"other, another; he, she, it";w_hsk1_10;0;0
11;这;zhè;this, the, here;w_hsk1_11;0;0
12;个;gè;"numerary adjunct, piece; single";w_hsk1_12;0;0
13;们;men;adjunct pronoun indicate plural;w_hsk1_13;0;0
14;中;zhōng;"central; center, middle; in the midst of; hit (target); attain";w_hsk1_14;0;0
15;来;lái;"come, coming; return, returning";w_hsk1_15;0;0
16;上;shàng;"top; superior, highest; go up, send up";w_hsk1_16;0;0
17;大;dà;big, great, vast, large, high;w_hsk1_17;0;0
18;和;hé;"harmony, peace; peaceful, calm";w_hsk1_18;0;0
19;国;guó;nation, country, nation-state;w_hsk1_19;0;0
20;说;shuō;"speak, say, talk; scold, upbraid";w_hsk1_20;0;0
21;时;shí;"time, season; era, age, period";w_hsk1_21;0;0
22;出;chū;"go out, send out; stand; produce";w_hsk1_22;0;0
23;会;huì;"assemble, meet together; meeting";w_hsk1_23;0;0
24;你;nǐ;you, second person pronoun;w_hsk1_24;0;0
25;对;duì;"correct, right; facing, opposed";w_hsk1_25;0;0
26;生;shēng;"life, living, lifetime; birth";w_hsk1_26;0;0
27;能;néng;"to be able; can, permitted to; ability";w_hsk1_27;0;0
28;子;zi;"offspring, child; fruit, seed of; 1st terrestrial branch";w_hsk1_28;0;0
29;那;nà;that, that one, those;w_hsk1_29;0;0
30;下;xià;"under, underneath, below; down; inferior; bring down";w_hsk1_30;0;0
31;年;nián;year;w_hsk1_31;0;0
32;后;hòu;"queen, empress, sovereign; (simp. for 後) behind, rear, after";w_hsk1_32;0;0
33;作;zuò;"make; work; compose, write; act, perform";w_hsk1_33;0;0
34;里;lǐ;"unit of distance; village; lane";w_hsk1_34;0;0
35;家;jiā;"house, home, residence; family";w_hsk1_35;0;0
36;多;duō;"much, many; more than, over";w_hsk1_36;0;0
37;么;me;"interrogative particle; repetition of a tune small; tender";w_hsk1_37;0;0
38;去;qù;go away, leave, depart;w_hsk1_38;0;0
39;学;xué;"learning, knowledge; school";w_hsk1_39;0;0
40;都;dōu;"metropolis, capital; all, the whole; elegant, refined";w_hsk1_40;0;0
41;同;tóng;"same, similar; together with";w_hsk1_41;0;0
42;现;xiàn;appear, manifest, become visible;w_hsk1_42;0;0
43;没;méi;"not, have not, none; drown, sink";w_hsk1_43;0;0
44;面;miàn;"face; surface; plane; side, dimension";w_hsk1_44;0;0
45;起;qǐ;"rise, stand up; go up; begin";w_hsk1_45;0;0
46;看;kàn;"look, see; examine, scrutinize";w_hsk1_46;0;0
47;天;tiān;"sky, heaven; god, celestial";w_hsk1_47;0;0
48;分;fēn;"divide; small unit of time etc.";w_hsk1_48;0;0
49;好;hǎo;"good, excellent, fine; well";w_hsk1_49;0;0
50;小;xiǎo;small, tiny, insignificant;w_hsk1_50;0;0
51;些;xiē;"little, few; rather, somewhat";w_hsk1_51;0;0
52;样;yàng;shape, form, pattern, style;w_hsk1_52;0;0
53;她;tā;she, her;w_hsk1_53;0;0
54;本;běn;"root, origin, source; basis";w_hsk1_54;0;0
55;前;qián;"in front, forward; preceding";w_hsk1_55;0;0
56;开;kāi;"open; initiate, begin, start";w_hsk1_56;0;0
57;想;xiǎng;think, speculate, plan, consider;w_hsk1_57;0;0
58;机;jī;"desk; machine; moment";w_hsk1_58;0;0
59;十;shí;"ten, tenth; complete; perfect";w_hsk1_59;0;0
60;工;gōng;"labor, work; worker, laborer";w_hsk1_60;0;0
61;明;míng;"bright, light, brilliant; clear";w_hsk1_61;0;0
62;三;sān;three;w_hsk1_62;0;0
63;关;guān;"frontier pass; close; relation";w_hsk1_63;0;0
64;点;diǎn;"dot, speck, spot; point, degree";w_hsk1_64;0;0
65;高;gāo;"high, tall; lofty, elevated";w_hsk1_65;0;0
66;很;hěn;very, quite, much;w_hsk1_66;0;0
67;见;jiàn;"see, observe, behold; perceive";w_hsk1_67;0;0
68;什;shén;"file of ten soldiers; mixed, miscellaneous";w_hsk1_68;0;0
69;二;èr;"two; twice";w_hsk1_69;0;0
70;果;guǒ;"fruit; result";w_hsk1_70;0;0
71;西;xī;"west(ern); westward, occident";w_hsk1_71;0;0
72;月;yuè;"moon; month; KangXi radical 74";w_hsk1_72;0;0
73;话;huà;"speech, talk, language; dialect";w_hsk1_73;0;0
74;回;huí;"return, turn around; a time";w_hsk1_74;0;0
75;老;lǎo;"old, aged; experienced";w_hsk1_75;0;0
76;先;xiān;first, former, previous;w_hsk1_76;0;0
77;儿;ér;"son, child; KangXi radical 10";w_hsk1_77;0;0
78;东;dōng;east, eastern, eastward;w_hsk1_78;0;0
79;水;shuǐ;water, liquid, lotion, juice;w_hsk1_79;0;0
80;名;míng;name, rank, title, position;w_hsk1_80;0;0
81;几;jǐ;small table;w_hsk1_81;0;0
82;认;rèn;recognize, know, understand;w_hsk1_82;0;0
83;系;xì;"system; line, link, connection";w_hsk1_83;0;0
84;气;qì;"steam, vapor; KangXi radical 84";w_hsk1_84;0;0
85;打;dǎ;"strike, hit, beat; fight; attack";w_hsk1_85;0;0
86;女;nǚ;"woman, girl; feminine; rad. 38";w_hsk1_86;0;0
87;四;sì;four;w_hsk1_87;0;0
88;电;diàn;"electricity; electric; lightning";w_hsk1_88;0;0
89;少;shǎo;few, less, inadequate;w_hsk1_89;0;0
90;太;tài;"very, too, much; big; extreme";w_hsk1_90;0;0
91;再;zài;again, twice, re-;w_hsk1_91;0;0
92;做;zuò;"work, make; act";w_hsk1_92;0;0
93;期;qī;"period of time; date; time limit";w_hsk1_93;0;0
94;五;wǔ;"five; surname";w_hsk1_94;0;0
95;书;shū;"book, letter, document; writings";w_hsk1_95;0;0
96;听;tīng;"hear; understand; obey, comply";w_hsk1_96;0;0
97;住;zhù;"reside, live at, dwell, lodge; stop";w_hsk1_97;0;0
98;北;běi;"north; northern; northward";w_hsk1_98;0;0
99;觉;jué;"to wake up from sleep; conscious";w_hsk1_99;0;0
100;师;shī;teacher, master, specialist;w_hsk1_100;0;0
101;今;jīn;now, today, modern era;w_hsk1_101;0;0
102;院;yuàn;"courtyard, yard, court; school";w_hsk1_102;0;0
103;识;shí;recognize, understand, know;w_hsk1_103;0;0
104;候;hòu;"wait; expect; visit; greet";w_hsk1_104;0;0
105;飞;fēi;"fly; go quickly; dart; high";w_hsk1_105;0;0
106;车;chē;"cart, vehicle; carry in cart";w_hsk1_106;0;0
107;服;fú;"clothes; wear, dress";w_hsk1_107;0;0
108;怎;zěn;what? why? how?;w_hsk1_108;0;0
109;呢;ne;"interrogative or emphatic final; (Cant.) this";w_hsk1_109;0;0
110;叫;jiào;"cry, shout; hail, greet, call";w_hsk1_110;0;0
111;影;yǐng;"shadow; image, reflection; photograph";w_hsk1_111;0;0
112;字;zì;letter, character, word;w_hsk1_112;0;0
113;爱;ài;love, be fond of, like;w_hsk1_113;0;0
114;商;shāng;commerce, business, trade;w_hsk1_114;0;0
115;请;qǐng;"ask, request; invite; please";w_hsk1_115;0;0
116;视;shì;look at, inspect, observe, see;w_hsk1_116;0;0
117;九;jiǔ;nine;w_hsk1_117;0;0
118;写;xiě;"write; draw, sketch; compose";w_hsk1_118;0;0
119;八;bā;"eight; all around, all sides";w_hsk1_119;0;0
120;吗;ma;final interrogative particle;w_hsk1_120;0;0
121;吃;chī;"eat; drink; suffer, endure, bear";w_hsk1_121;0;0
122;六;liù;number six;w_hsk1_122;0;0
123;医;yī;"cure, heal; doctor, medical";w_hsk1_123;0;0
124;号;hào;"mark, sign; symbol; number";w_hsk1_124;0;0
125;语;yǔ;"language, words; saying, expression";w_hsk1_125;0;0
126;七;qī;seven;w_hsk1_126;0;0
127;兴;xìng;thrive, prosper, flourish;w_hsk1_127;0;0
128;星;xīng;"a star, planet; any point of light";w_hsk1_128;0;0
129;京;jīng;capital city;w_hsk1_129;0;0
130;米;mǐ;hulled or husked uncooked rice;w_hsk1_130;0;0
131;客;kè;"guest, traveller; customer";w_hsk1_131;0;0
132;友;yǒu;"friend, companion; fraternity";w_hsk1_132;0;0
133;钱;qián;money, currency, coins;w_hsk1_133;0;0
134;热;rè;"hot; heat; fever; restless; zeal";w_hsk1_134;0;0
135;坐;zuò;"sit; seat; ride, travel by";w_hsk1_135;0;0
136;校;xiào;"school; military field officer";w_hsk1_136;0;0
137;脑;nǎo;brain;w_hsk1_137;0;0
138;谁;shuí;who? whom? whose? anyone?;w_hsk1_138;0;0
139;哪;nǎ;which? where? how?;w_hsk1_139;0;0
140;喜;xǐ;"like, love, enjoy; joyful thing";w_hsk1_140;0;0
141;习;xí;"practice; flapping wings";w_hsk1_141;0;0
142;欢;huān;"happy, pleased, glad; joy; enjoy";w_hsk1_142;0;0
143;冷;lěng;"cold, cool; lonely";w_hsk1_143;0;0
144;汉;hàn;"Chinese people; Chinese language";w_hsk1_144;0;0
145;衣;yī;"clothes, clothing; cover, skin";w_hsk1_145;0;0
146;妈;mā;mother, mama;w_hsk1_146;0;0
147;读;dú;"read, study; pronounce";w_hsk1_147;0;0
148;买;mǎi;"buy, purchase; bribe, persuade";w_hsk1_148;0;0
149;岁;suì;"year; age; harvest";w_hsk1_149;0;0
150;块;kuài;"piece, lump; dollar";w_hsk1_150;0;0
151;姐;jiě;elder sister, young lady;w_hsk1_151;0;0
152;亮;liàng;bright, brilliant, radiant, light;w_hsk1_152;0;0
153;朋;péng;friend, pal, acquaintance;w_hsk1_153;0;0
154;谢;xiè;"thank; decline";w_hsk1_154;0;0
155;钟;zhōng;"clock; bell";w_hsk1_155;0;0
156;雨;yǔ;"rain; rainy; KangXi radical 173";w_hsk1_156;0;0
157;饭;fàn;"cooked rice; food, meal";w_hsk1_157;0;0
158;睡;shuì;sleep, doze;w_hsk1_158;0;0
159;喝;hē;"drink; shout, call out";w_hsk1_159;0;0
160;午;wǔ;"noon; 7th terrestrial branch";w_hsk1_160;0;0
161;店;diàn;"shop, store; inn, hotel";w_hsk1_161;0;0
162;爸;bà;father, papa;w_hsk1_162;0;0
163;桌;zhuō;table, desk, stand;w_hsk1_163;0;0
164;菜;cài;"vegetables; dish, order; food";w_hsk1_164;0;0
165;茶;chá;tea;w_hsk1_165;0;0
166;狗;gǒu;dog, canis familiaris;w_hsk1_166;0;0
167;杯;bēi;cup, glass;w_hsk1_167;0;0
168;租;zū;"rent, lease; rental; tax";w_hsk1_168;0;0
169;昨;zuó;"yesterday; in former times, past";w_hsk1_169;0;0
170;漂;piào;"float, drift; tossed about";w_hsk1_170;0;0
171;椅;yǐ;chair, seat;w_hsk1_171;0;0
172;猫;māo;cat;w_hsk1_172;0;0
173;喂;wèi;interjection to call attention;w_hsk1_173;0;0
174;苹;píng;"artemisia; duckweed; apple";w_hsk1_174;0;0
175;为;wèi;"do, handle, govern, act; be";w_hsk1_175;0;0
176;到;dào;go to, arrive, been to;w_hsk1_176;0;0
177;以;yǐ;"by means of; thereby, therefore; consider as; in order to";w_hsk1_177;0;0
178;要;yào;"necessary, essential; necessity";w_hsk1_178;0;0
179;就;jiù;"just, simply; to come, go to; to approach, near";w_hsk1_179;0;0
180;可;kě;"may, can, -able; possibly";w_hsk1_180;0;0
181;也;yě;"also; classical final particle of strong affirmation or identity";w_hsk1_181;0;0
182;得;dé;obtain, get, gain, acquire;w_hsk1_182;0;0
183;着;zhe;make move, take action;w_hsk1_183;0;0
184;过;guò;pass, pass through, go across;w_hsk1_184;0;0
185;道;dào;"path, road, street; method, way";w_hsk1_185;0;0
186;所;suǒ;"place, location; numerary adjunct";w_hsk1_186;0;0
187;然;rán;"yes, certainly; pledge, promise";w_hsk1_187;0;0
188;事;shì;"affair, matter, business; to serve; accident, incident";w_hsk1_188;0;0
189;经;jīng;"classic works; pass through";w_hsk1_189;0;0
190;动;dòng;"move, happen; movement, action";w_hsk1_190;0;0
191;还;hái;still, yet, also, besides;w_hsk1_191;0;0
192;进;jìn;advance, make progress, enter;w_hsk1_192;0;0
193;但;dàn;"only; but, however, yet, still";w_hsk1_193;0;0
194;因;yīn;"cause, reason; by; because (of)";w_hsk1_194;0;0
195;从;cóng;from, by, since, whence, through;w_hsk1_195;0;0
196;日;rì;"sun; day; daytime";w_hsk1_196;0;0
197;意;yì;"thought, idea, opinion; think";w_hsk1_197;0;0
198;它;tā;"it; other";w_hsk1_198;0;0
199;长;zhǎng;"long; length; excel in; leader";w_hsk1_199;0;0
200;第;dì;"sequence, number; grade, degree";w_hsk1_200;0;0
201;公;gōng;"fair, equitable; public; duke";w_hsk1_201;0;0
202;已;yǐ;"already; finished; stop";w_hsk1_202;0;0
203;情;qíng;feeling, sentiment, emotion;w_hsk1_203;0;0
204;知;zhī;know, perceive, comprehend;w_hsk1_204;0;0
205;正;zhèng;right, proper, correct;w_hsk1_205;0;0
206;外;wài;"out, outside, external; foreign";w_hsk1_206;0;0
207;两;liǎng;"two, both, pair, couple; ounce";w_hsk1_207;0;0
208;间;jiān;"midpoint, space; place, locality";w_hsk1_208;0;0
209;问;wèn;ask about, inquire after;w_hsk1_209;0;0
210;最;zuì;most, extremely, exceedingly;w_hsk1_210;0;0
211;手;shǒu;hand;w_hsk1_211;0;0
212;体;tǐ;"body; group, class, body, unit; inferior";w_hsk1_212;0;0
213;等;děng;"rank, grade; wait; equal; 'etc.'";w_hsk1_213;0;0
214;新;xīn;new, recent, fresh, modern;w_hsk1_214;0;0
215;身;shēn;"body; trunk, hull; rad. no. 158";w_hsk1_215;0;0
216;表;biǎo;show, express, manifest, display;w_hsk1_216;0;0
217;给;gěi;"give; by, for";w_hsk1_217;0;0
218;次;cì;"order, sequence; next";w_hsk1_218;0;0
219;门;mén;gate, door, entrance, opening;w_hsk1_219;0;0
220;常;cháng;common, normal, frequent, regular;w_hsk1_220;0;0
221;教;jiào;teach, class;w_hsk1_221;0;0
222;比;bǐ;"to compare, liken; comparison; than";w_hsk1_222;0;0
223;员;yuán;"member; personnel, staff member";w_hsk1_223;0;0
224;真;zhēn;real, actual, true, genuine;w_hsk1_224;0;0
225;走;zǒu;"walk, go on foot; run; leave";w_hsk1_225;0;0
226;条;tiáo;"clause, condition; string, stripe";w_hsk1_226;0;0
227;题;tí;"forehead; title, headline; theme";w_hsk1_227;0;0
228;别;bié;"separate, other; do not";w_hsk1_228;0;0
229;报;bào;report, tell, announce;w_hsk1_229;0;0
230;务;wù;"affairs, business; must, should";w_hsk1_230;0;0
231;场;chǎng;open space, field, market;w_hsk1_231;0;0
232;件;jiàn;"numerary adjunct for article; matter";w_hsk1_232;0;0
233;便;biàn;"convenience, ease; expedient";w_hsk1_233;0;0
234;司;sī;"take charge of, control, manage; officer";w_hsk1_234;0;0
235;眼;yǎn;"eye; eyelet, hole, opening";w_hsk1_235;0;0
236;非;fēi;"not, negative, non-; oppose";w_hsk1_236;0;0
237;白;bái;"white; pure, unblemished; bright";w_hsk1_237;0;0
238;思;sī;"think, consider, ponder; final particle";w_hsk1_238;0;0
239;完;wán;"complete, finish, settle; whole";w_hsk1_239;0;0
240;色;sè;"color, tint, hue, shade; form, body; beauty, desire for beauty";w_hsk1_240;0;0
241;路;lù;"road, path, street; journey";w_hsk1_241;0;0
242;告;gào;"tell, announce, inform; accuse";w_hsk1_242;0;0
243;边;biān;edge, margin, side, border;w_hsk1_243;0;0
244;望;wàng;"to look at, look forward; to hope, expect";w_hsk1_244;0;0
245;共;gòng;"together with, all, total; to share";w_hsk1_245;0;0
246;让;ràng;allow, permit, yield, concede;w_hsk1_246;0;0
247;运;yùn;"run; simplified form of 運 luck, fortune; ship, transport";w_hsk1_247;0;0
248;笑;xiào;"smile, laugh, giggle; snicker";w_hsk1_248;0;0
249;步;bù;"step, pace; walk, stroll";w_hsk1_249;0;0
250;每;měi;every, each;w_hsk1_250;0;0
251;快;kuài;"rapid, quick, speedy, fast; soon";w_hsk1_251;0;0
252;往;wǎng;"go, depart; past, formerly";w_hsk1_252;0;0
253;近;jìn;"near, close; approach; intimate";w_hsk1_253;0;0
254;夫;fū;"man, male adult, husband; those";w_hsk1_254;0;0
255;准;zhǔn;"approve, allow, permit; in accord";w_hsk1_255;0;0
256;始;shǐ;"begin, start; then, only then";w_hsk1_256;0;0
257;远;yuǎn;"distant, remote, far; profound";w_hsk1_257;0;0
258;备;bèi;prepare, ready, perfect;w_hsk1_258;0;0
259;百;bǎi;"one hundred; numerous, many";w_hsk1_259;0;0
260;离;lí;"rare beast; strange; elegant";w_hsk1_260;0;0
261;病;bìng;illness, sickness, disease;w_hsk1_261;0;0
262;息;xī;rest, put stop to, end, cease;w_hsk1_262;0;0
263;火;huǒ;"fire, flame; burn; anger, rage";w_hsk1_263;0;0
264;早;zǎo;"early; soon; morning";w_hsk1_264;0;0
265;找;zhǎo;"search, seek, look for; find";w_hsk1_265;0;0
266;吧;ba;emphatic final particle;w_hsk1_266;0;0
267;考;kǎo;"examine, test; investigate";w_hsk1_267;0;0
268;红;hóng;"red, vermillion; blush, flush";w_hsk1_268;0;0
269;虽;suī;although, even if;w_hsk1_269;0;0
270;希;xī;"rare; hope, expect, strive for";w_hsk1_270;0;0
271;房;fáng;"house, building; room";w_hsk1_271;0;0
272;黑;hēi;"black; dark; evil, sinister";w_hsk1_272;0;0
273;足;zú;"foot; attain, satisfy, enough";w_hsk1_273;0;0
274;孩;hái;"baby, child; children";w_hsk1_274;0;0
275;站;zhàn;"stand up; a stand, station";w_hsk1_275;0;0
276;诉;sù;"accuse; sue; inform; narrate";w_hsk1_276;0;0
277;千;qiān;"thousand; many, numerous; very; (Cant.) a cheater, swindler";w_hsk1_277;0;0
278;男;nán;"male, man; son; baron; surname";w_hsk1_278;0;0
279;助;zhù;help, aid, assist;w_hsk1_279;0;0
280;乐;lè;"happy, glad; enjoyable; music";w_hsk1_280;0;0
281;球;qiú;"ball, sphere, globe; round";w_hsk1_281;0;0
282;错;cuò;"error, blunder, mistake; wrong";w_hsk1_282;0;0
283;晚;wǎn;"night, evening; late";w_hsk1_283;0;0
284;试;shì;test, try, experiment;w_hsk1_284;0;0
285;送;sòng;"see off, send off; dispatch, give";w_hsk1_285;0;0
286;药;yào;"leaf of Dahurian angelica plant; medicine";w_hsk1_286;0;0
287;游;yóu;"to swim; float, drift; wander, roam";w_hsk1_287;0;0
288;室;shì;room, home, house, chamber;w_hsk1_288;0;0
289;您;nín;honorific for 'you' ;w_hsk1_289;0;0
290;帮;bāng;"help, assist; defend; shoe upper";w_hsk1_290;0;0
291;左;zuǒ;"left; east; unorthodox, improper";w_hsk1_291;0;0
292;右;yòu;"right; west; right-wing";w_hsk1_292;0;0
293;穿;chuān;"penetrate, pierce, drill; wear";w_hsk1_293;0;0
294;哥;gē;elder brother;w_hsk1_294;0;0
295;弟;dì;"young brother; junior; i, me";w_hsk1_295;0;0
296;慢;màn;slow(ly), leisurely, sluggish;w_hsk1_296;0;0
297;忙;máng;"busy, pressed for time; hustling";w_hsk1_297;0;0
298;介;jiè;"forerunner, herald, harbinger; to lie between; sea shell; to wear armor";w_hsk1_298;0;0
299;鱼;yú;"fish; surname; KangXi radical 195";w_hsk1_299;0;0
300;跑;pǎo;run, flee, leave in hurry;w_hsk1_300;0;0
301;贵;guì;expensive, costly, valuable;w_hsk1_301;0;0
302;班;bān;"class, group, grade; squad; job";w_hsk1_302;0;0
303;票;piào;"slip of paper or bamboo; ticket";w_hsk1_303;0;0
304;睛;jīng;"eyeball; pupil of eye";w_hsk1_304;0;0
305;旅;lǚ;"trip, journey; travel; traveler";w_hsk1_305;0;0
306;笔;bǐ;"writing brush; write; stroke";w_hsk1_306;0;0
307;卖;mài;"sell; betray; show off";w_hsk1_307;0;0
308;旁;páng;"side; by side, close by, near";w_hsk1_308;0;0
309;阴;yīn;"principle; dark; secret";w_hsk1_309;0;0
310;跳;tiào;"jump, leap, vault, bounce; dance";w_hsk1_310;0;0
311;雪;xuě;"snow; wipe away shame, avenge";w_hsk1_311;0;0
312;肉;ròu;"flesh; meat; KangXi radical 130";w_hsk1_312;0;0
313;馆;guǎn;public building;w_hsk1_313;0;0
314;牛;niú;"cow, ox, bull; KangXi radical93";w_hsk1_314;0;0
315;纸;zhǐ;paper;w_hsk1_315;0;0
316;歌;gē;"song, lyrics; sing, chant; praise";w_hsk1_316;0;0
317;床;chuáng;"bed, couch; framework, chassis";w_hsk1_317;0;0
318;玩;wán;play with, joke, enjoy;w_hsk1_318;0;0
319;妻;qī;wife;w_hsk1_319;0;0
320;休;xiū;"rest, stop; retire; do not!";w_hsk1_320;0;0
321;舞;wǔ;"dance, posture, prance; brandish";w_hsk1_321;0;0
322;姓;xìng;"one's family name; clan, people";w_hsk1_322;0;0
323;妹;mèi;younger sister;w_hsk1_323;0;0
324;汽;qì;steam, vapor, gas;w_hsk1_324;0;0
325;课;kè;"lesson; course; classwork";w_hsk1_325;0;0
326;懂;dǒng;understand, comprehend;w_hsk1_326;0;0
327;绍;shào;"continue, carry on; join";w_hsk1_327;0;0
328;丈;zhàng;"unit of length equal 3.3 meters; gentleman, man, husband";w_hsk1_328;0;0
329;洗;xǐ;"wash, rinse; clean, purify";w_hsk1_329;0;0
330;唱;chàng;"sing, chant, call; ditty, song";w_hsk1_330;0;0
331;奶;nǎi;"milk; woman's breasts; nurse";w_hsk1_331;0;0
332;宜;yí;suitable, right, fitting, proper;w_hsk1_332;0;0
333;累;lèi;"tired; implicate, involve; bother";w_hsk1_333;0;0
334;羊;yáng;"sheep, goat; KangXi radical 123";w_hsk1_334;0;0
335;零;líng;"zero; fragment, fraction";w_hsk1_335;0;0
336;蛋;dàn;"eggs; term of abuse";w_hsk1_336;0;0
337;鸡;jī;chicken;w_hsk1_337;0;0
338;宾;bīn;"guest, visitor; surname; submit";w_hsk1_338;0;0
339;颜;yán;face, facial appearance;w_hsk1_339;0;0
340;瓜;guā;"melon, gourd, cucumber; rad. 97";w_hsk1_340;0;0
341;晴;qíng;clear weather, fine weather;w_hsk1_341;0;0
342;啡;fēi;"morphine; coffee";w_hsk1_342;0;0
343;篮;lán;basket;w_hsk1_343;0;0
344;咖;kā;"coffee; a phonetic";w_hsk1_344;0;0
345;踢;tī;kick;w_hsk1_345;0;0
346;泳;yǒng;"dive; swim";w_hsk1_346;0;0
347;铅;qiān;lead;w_hsk1_347;0;0
348;地;de;"earth; soil, ground; region";w_hsk1_348;0;0
349;而;ér;"and; and then; and yet; but";w_hsk1_349;0;0
350;于;yú;"in, on, at; go to; surname";w_hsk1_350;0;0
351;自;zì;"self, private, personal; from";w_hsk1_351;0;0
352;发;fā;"issue, dispatch, send out; hair";w_hsk1_352;0;0
353;用;yòng;"use, employ, apply, operate; use";w_hsk1_353;0;0
354;行;xíng;"go; walk; move, travel; circulate";w_hsk1_354;0;0
355;种;zhǒng;"seed; race, breed; to plant";w_hsk1_355;0;0
356;成;chéng;completed, finished, fixed;w_hsk1_356;0;0
357;方;fāng;"a square, rectangle; a region; local";w_hsk1_357;0;0
358;法;fǎ;"law, rule, regulation, statute; France, French";w_hsk1_358;0;0
359;如;rú;"if, supposing; as if; like, as";w_hsk1_359;0;0
360;当;dāng;"bear, accept, undertake; just";w_hsk1_360;0;0
361;定;dìng;decide, settle, fix;w_hsk1_361;0;0
362;其;qí;"his, her, its, their; that";w_hsk1_362;0;0
363;主;zhǔ;"master, chief owner; host; lord";w_hsk1_363;0;0
364;理;lǐ;"reason, logic; manage";w_hsk1_364;0;0
365;心;xīn;"heart; mind, intelligence; soul";w_hsk1_365;0;0
366;只;zhǐ;only, just, simply;w_hsk1_366;0;0
367;实;shí;"real, true; honest, sincere";w_hsk1_367;0;0
368;者;zhě;"that which; he who; those who";w_hsk1_368;0;0
369;力;lì;power, capability, influence;w_hsk1_369;0;0
370;把;bǎ;"hold, take; guard; regard as";w_hsk1_370;0;0
371;又;yòu;and, also, again, in addition;w_hsk1_371;0;0
372;业;yè;"profession, business; GB radical 111";w_hsk1_372;0;0
373;重;zhòng;"heavy, weighty; double";w_hsk1_373;0;0
374;物;wù;thing, substance, creature;w_hsk1_374;0;0
375;应;yīng;should, ought to, must;w_hsk1_375;0;0
376;向;xiàng;toward, direction, trend;w_hsk1_376;0;0
377;头;tóu;"head; top; chief, first; boss";w_hsk1_377;0;0
378;文;wén;literature, culture, writing;w_hsk1_378;0;0
379;相;xiāng;mutual, reciprocal, each other;w_hsk1_379;0;0
380;被;bèi;"passive indicator 'by'; bedding";w_hsk1_380;0;0
381;或;huò;"or, either, else; perhaps, maybe";w_hsk1_381;0;0
382;己;jǐ;"self, oneself; personal, private; 6th heavenly stem";w_hsk1_382;0;0
383;加;jiā;add to, increase, augment;w_hsk1_383;0;0
384;特;tè;special, unique, distinguished;w_hsk1_384;0;0
385;信;xìn;"trust, believe; letter";w_hsk1_385;0;0
386;化;huà;"change, convert, reform; -ize";w_hsk1_386;0;0
387;世;shì;"generation; world; era";w_hsk1_387;0;0
388;位;wèi;"throne; position, post; rank, status; seat";w_hsk1_388;0;0
389;声;shēng;"sound, voice, noise; tone; music";w_hsk1_389;0;0
390;提;tí;"hold in hand; lift in hand";w_hsk1_390;0;0
391;解;jiě;"loosen, unfasten, untie; explain";w_hsk1_391;0;0
392;口;kǒu;"mouth; open end; entrance, gate";w_hsk1_392;0;0
393;平;píng;"flat, level, even; peaceful";w_hsk1_393;0;0
394;更;gèng;more, still further, much more;w_hsk1_394;0;0
395;变;biàn;"change, transform, alter; rebel";w_hsk1_395;0;0
396;总;zǒng;"collect; overall, altogether";w_hsk1_396;0;0
397;数;shù;"number; several, count; fate";w_hsk1_397;0;0
398;安;ān;peaceful, tranquil, quiet;w_hsk1_398;0;0
399;才;cái;"talent, ability; just, only";w_hsk1_399;0;0
400;结;jié;"knot, tie; join, connect";w_hsk1_400;0;0
401;目;mù;"eye; look, see; division, topic";w_hsk1_401;0;0
402;感;gǎn;feel, perceive, emotion;w_hsk1_402;0;0
403;接;jiē;"receive; continue; catch; connect";w_hsk1_403;0;0
404;必;bì;"surely, most certainly; must";w_hsk1_404;0;0
405;市;shì;"market, fair; city, town; trade";w_hsk1_405;0;0
406;直;zhí;straight, erect, vertical;w_hsk1_406;0;0
407;山;shān;mountain, hill, peak;w_hsk1_407;0;0
408;空;kōng;empty, hollow, bare, deserted;w_hsk1_408;0;0
409;决;jué;decide, determine, judge;w_hsk1_409;0;0
410;马;mǎ;"horse; surname; KangXi radical 187";w_hsk1_410;0;0
411;界;jiè;"boundary, limit; domain; society; the world";w_hsk1_411;0;0
412;放;fàng;put, release, free, liberate;w_hsk1_412;0;0
413;像;xiàng;"a picture, image, figure; to resemble";w_hsk1_413;0;0
414;且;qiě;"moreover, also (post-subject); about to, will soon (pre-verb)";w_hsk1_414;0;0
415;难;nán;"difficult, arduous, hard; unable";w_hsk1_415;0;0
416;记;jì;"record; keep in mind, remember";w_hsk1_416;0;0
417;南;nán;"south; southern part; southward";w_hsk1_417;0;0
418;求;qiú;"seek; demand, request; beseech";w_hsk1_418;0;0
419;据;jù;"to occupy, take possession of; a base, position";w_hsk1_419;0;0
420;张;zhāng;"stretch, extend, expand; sheet";w_hsk1_420;0;0
421;该;gāi;should, ought to, need to;w_hsk1_421;0;0
422;万;wàn;"ten thousand; innumerable";w_hsk1_422;0;0
423;清;qīng;"clear, pure, clean; peaceful";w_hsk1_423;0;0
424;带;dài;belt, girdle, band, strap, zone;w_hsk1_424;0;0
425;风;fēng;"wind; air; manners, atmosphere";w_hsk1_425;0;0
426;根;gēn;"root, base(d on); foundation";w_hsk1_426;0;0
427;干;gàn;"oppose, offend; invade; dried";w_hsk1_427;0;0
428;极;jí;extreme, utmost, furthest, final;w_hsk1_428;0;0
429;办;bàn;"manage, do, handle; deal with";w_hsk1_429;0;0
430;议;yì;consult, talk over, discuss;w_hsk1_430;0;0
431;元;yuán;"first; dollar; origin; head";w_hsk1_431;0;0
432;单;dān;"single, individual, only; lone";w_hsk1_432;0;0
433;调;diào;"transfer, move, change; tune";w_hsk1_433;0;0
434;算;suàn;"count, calculate, figure; plan";w_hsk1_434;0;0
435;需;xū;need, require, must;w_hsk1_435;0;0
436;花;huā;"flower; blossoms";w_hsk1_436;0;0
437;城;chéng;"castle; city, town; municipality";w_hsk1_437;0;0
438;级;jí;"level, rank, class; grade";w_hsk1_438;0;0
439;复;fù;"return; repeat; repeatedly";w_hsk1_439;0;0
440;满;mǎn;"fill; full, satisfied";w_hsk1_440;0;0
441;越;yuè;"exceed, go beyond; the more ...";w_hsk1_441;0;0
442;容;róng;"looks, appearance; figure, form";w_hsk1_442;0;0
443;照;zhào;shine, illumine, reflect;w_hsk1_443;0;0
444;须;xū;must, have to, necessary;w_hsk1_444;0;0
445;包;bāo;"wrap, pack, bundle; package";w_hsk1_445;0;0
446;片;piàn;"slice, splinter, strip; rad. 91";w_hsk1_446;0;0
447;史;shǐ;history, chronicle, annals;w_hsk1_447;0;0
448;乎;hū;interrogative or exclamatory final particle;w_hsk1_448;0;0
449;查;chá;investigate, examine, seek into;w_hsk1_449;0;0
450;轻;qīng;"light; easy, simple; gentle";w_hsk1_450;0;0
